Projeto ID,Título do Projeto,Tipo do projeto,Início da Execução,Término da Execução,Área do Conhecimento,Área Temática,Resumo
https://suap.iff.edu.br/sisep/projeto/665/,“DIAGNÓSTICO AMBIENTAL DE NASCENTES EM AFLUENTES DO RIO MURIAÉ”,Pesquisa,15/03/2021,31/12/2021,RECURSOS FLORESTAIS E ENGENHARIA FLORESTAL (CIÊNCIAS AGRÁRIAS),Meio Ambiente,"O presente projeto se aterá ao diagnóstico ambiental de nascentes degradadas situadas no entorno da foz do rio Muriaé, notadamente as que contribuem para o aporte hídrico  microbacias, considerando que processam, em condições de preservação e florestamento, significativos volumes de água de chuva recebidos anualmente.
A região de abrangência do projeto englobará o entorno norte e noroeste da sede municipal de Campos dos Goytacazes R.J. - 15 km da porção terminal do rio Muriaé.
A coleta de dados de campos servirá de base técnica para a implementação de projetos executivos voltados à restauração de matas nativas na região.
A metodologia a ser empregada envolverá uma série de levantamentos de campo no âmbito físico, químico e biológico. O tratamento das informações obtidas nos indicará qual será o caminho a ser trilhado com vistas à recomposição dos ecossistemas florestais nativos e das fisionomias de origem das nascentes estudadas."
https://suap.iff.edu.br/sisep/projeto/665/,“DIAGNÓSTICO AMBIENTAL DE NASCENTES EM AFLUENTES DO RIO MURIAÉ”,Pesquisa,15/03/2021,31/12/2021,RECURSOS FLORESTAIS E ENGENHARIA FLORESTAL (CIÊNCIAS AGRÁRIAS),Meio Ambiente,"O presente projeto se aterá ao diagnóstico ambiental de nascentes degradadas situadas no entorno da foz do rio Muriaé, notadamente as que contribuem para o aporte hídrico  microbacias, considerando que processam, em condições de preservação e florestamento, significativos volumes de água de chuva recebidos anualmente.
A região de abrangência do projeto englobará o entorno norte e noroeste da sede municipal de Campos dos Goytacazes R.J. - 15 km da porção terminal do rio Muriaé.
A coleta de dados de campos servirá de base técnica para a implementação de projetos executivos voltados à restauração de matas nativas na região.
A metodologia a ser empregada envolverá uma série de levantamentos de campo no âmbito físico, químico e biológico. O tratamento das informações obtidas nos indicará qual será o caminho a ser trilhado com vistas à recomposição dos ecossistemas florestais nativos e das fisionomias de origem das nascentes estudadas."
https://suap.iff.edu.br/sisep/projeto/457/,Rádio IFF Educativa,Arte e Cultura,04/05/2020,04/09/2020,COMUNICAÇÃO (CIÊNCIAS SOCIAIS APLICADAS),Comunicação,"             Rádio IFF Educativa é um projeto que se desenvolve dentro de um ambiente escolar, isso se dá dentro do Instituto Federal Fluminense, exatamente no Campus Campos-Guarus.  Esse projeto tem sido desenvolvido envolvendo alunos do ensino médio e alunos da Licenciatura.  Porém, a adequação desse projeto nesse período de pandemia se dará a partir das ferramentas disponíveis no formato Homework, fornecendo assim domiciliarmente toda condição e aparato tecnológico para o justo funcionamento da plataforma digital streaming de Rádio Web.  
            A sua configuração Educativa e em conexão com as redes sociais, provê para o ouvinte toda inteiração e aprendizado e entretenimento, e abraça também os professores e profissionais da região lhes dando condições e oportunidades de apresentarem suas contribuições via palestras, Aulas virtuais (AulaCast), e disponibilizando esse conteúdo em posterior via redes sociais (YouTube).  Uma excelente oportunidade que se apresenta como uma das ferramentas visando contribuir com a sociedade nesses dias tão desafiadores."
https://suap.iff.edu.br/sisep/projeto/505/,Sistema Automatizado de Monitoramento Térmico dos transeuntes nas dependências do IFF-Campus Guarus,Integração Pesquisa-Extensão,04/05/2020,04/09/2020,ENGENHARIA ELÉTRICA (ENGENHARIAS),Saúde,"A redução de aceleração do contágio de uma pandemia  e morte ocasionada por esta, ocorre quando mais de 50% da população foi infectada. Estima-se que a fase aguda de contaminação por SARS-CoV-2 (COVID-19) ocorrerá por volta do dia 20/05/2020, contudo, a possibilidade de contaminação e suas consequências ainda serão vividas pela sociedade brasileira. Escolas fazem parte do grupo específico de aglomeradores por natureza; Faz-se necessária a implantação de sistema que possibilite a monitoração massiva dos transeuntes desse ambiente e detecção de indivíduos portadores de sintomas que indiquem o contágio por SARS-CoV-2 (COVID-19). O presente projeto sugere a utilização do sistema de visão automatizado da National instruments (NI Vision), com elementos de monitoração (Câmeras inteligentes e/ou termográficas) montados no espaço de entrada de pedestres e ciclistas, no espaço de localização do registro de ponto biométrico e alguns outros pontos estratégicos das dependências do IFF campus Campos Guarus. Os dados são tratados pela plataforma de algoritmos dedicada Labview®, embarcada em computador de uso exclusivo, sendo ligado a rede interna do IFF Guarus para integração de vários setores. Na ocorrência de eventos, os indivíduos são identificados, através de alarme na central de monitoramento e devidamente encaminhados ao setor de saúde para procedimento de triagem específica e adequados encaminhamentos. Espera-se monitorar, diariamente, 100% dos transeuntes nas dependências do IFF campus Campos Guarus, contribuindo com isso para controle da capacidade de contaminação dentro do espeço da instituição, reduzindo-a consideravelmente."
