Projeto ID,Título do Projeto,Tipo do projeto,Início da Execução,Término da Execução,Área do Conhecimento,Área Temática,Resumo
https://suap.iff.edu.br/sisep/projeto/1139/,Nível de Conhecimento e Atitudes Demonstradas Por Portadores de Diabetes Tipo II: Estudo do Perfil dos Idosos Atendidos no IFF Campus Campos Guarús,Pesquisa,14/03/2022,31/12/2022,ENFERMAGEM (CIÊNCIAS DA SAÚDE),Saúde,"O aumento da expectativa de vida do brasileiro é uma conquista que traz consigo alguns desafios, tais como elevação da incidência e da prevalência das doenças crônicas não transmissíveis, entre elas a diabetes mellitus (DM). Sendo assim, este projeto busca identificar o perfil dos idosos portadores de diabetes mellitus tipo II atendidos no IFF Campus Campos Guarús/RJ, segundo suas variáveis clínicas e sócio-demográficas e de acordo com o nível de conhecimento e atitudes apresentados pelos mesmos em relação à doença. Métodos: O projeto será desenvolvido nas dependências do instituto, tendo como público alvo todos os idosos com diagnóstico de diabetes mellitus cadastrados nos projetos Vitalidade e Sistematização da Assistência de Enfermagem em Gerontologia do IFF Campus Campos Guarús. Os dados serão coletados através da aplicação de questionários contendo variáveis sócio demográficas e clínicas, além das versões brasileiras do Diabetes Knowledge Questionnaire (DKN-A) e do Diabetes Attitude Questionnaire (ATT-19). Os dados serão digitados no Excel e posteriormente exportados para o Statistical Package for the Social Sciences (SPSS), onde serão realizadas as análises descritivas das variáveis. Todos os participantes que aceitarem participar da pesquisa deverão ler e assinar o Termo de Consentimento Livre e Esclarecido, conforme a Resolução 466/12 do Conselho Nacional de Saúde. O projeto será submetido ao comitê de ética e pesquisa. Espera-se que esse estudo contribua para o reconhecimento da importância da avaliação do indivíduo com diabetes mellitus no tocante a variáveis biológicas e psicossociais, que podem interferir no manejo da doença pelo indivíduo ou na capacidade da família de colaborar com o cuidado em diabetes."
https://suap.iff.edu.br/sisep/projeto/1176/,PERCEPÇÕES E SIGNIFICADOS DAS PRÁTICAS CORPORAIS NO DESENVOLVIMENTO DE CRIANÇAS E ADOLESCENTES ATENDIDOS NO CENTRO DE ATENÇÃO PSICOSSOCIAL INFANTO-JUVENIL (CAPSI),Pesquisa,14/03/2022,31/12/2022,EDUCAÇÃO (CIÊNCIAS HUMANAS),Saúde,"A presente pesquisa está vinculada ao Projeto de extensão “Movi Mente: Saúde e Inclusão em foco” do Instituto Federal Fluminense campus Campos Guarus. Sua proposta pretende investigar a intervenção da Educação Física, através de estímulos às práticas corporais, junto a crianças e adolescentes com transtornos mentais atendidos pelo Centro de Atenção Psicossocial Infanto-juvenil (CAPSi) em Campos dos Goytacazes/RJ. O estudo foi aprovado pelo Comitê de Ética em Pesquisa - CEP da Fundação Cultural de Campos - Centro Universitário Fluminense - UNIFLU sob o número 47746921.6.0000.5583. O principal objetivo da investigação é analisar as percepções e significados das práticas corporais no desenvolvimento dos usuários do CAPSi, identificando aspectos de promoção à saúde integral. A abordagem da pesquisa será de cunho qualitativo, através de um estudo de caso com observação participante, análise documental, entrevistas semiestruturadas com os familiares das crianças e adolescentes e grupo focal com os profissionais do CAPSi que estarão acompanhando os participantes da intervenção. Os resultados do estudo poderão identificar apontamentos sobre os estímulos e vivências das crianças e adolescentes na perspectiva do cuidado e o significado das práticas corporais na promoção à saúde integral. Além disso, a pesquisa poderá contribuir na formação profissional do professor de Educação Física considerando sua intervenção no campo da saúde pública."
https://suap.iff.edu.br/sisep/projeto/1218/,AVALIAÇÃO DAS PROPRIEDADES FÍSICAS E MECÂNICAS DOS PRODUTOS DE CERÂMICA VERMELHA DE CAMPOS DOS GOYTACAZES,Pesquisa,14/03/2022,31/12/2022,ENGENHARIA DE MATERIAIS E METALÚRGICA (ENGENHARIAS),Tecnologia e Produção,"No geral, os materiais cerâmicos são divididos em avançados e tradicionais, sendo que dentro deste último tem-se as ""cerâmicas vermelhas"" cuja definição possui um significado amplo, compreendendo aqueles materiais empregados na construção civil (argila expandida, tijolos, blocos, elementos vazados, lajes, telhas e tubos cerâmicos) e alguns de uso doméstico e afins.  Esses produtos, por sua vez, são obtidos em empresas denominadas cerâmicas. A região de Campos dos Goytacazes/RJ é um dos principais polos de produção desses produtos no Brasil. O principal objetivo desse trabalho é avaliar as propriedades físicas e mecânicas dos produtos oriundos das empresas cerâmicas da região.  Para tal serão realizados ensaios de absorção de água, densidade aparente e tensão de ruptura à flexão. Com isso, pretende-se verificar se os produtos estão em conformidade com as normas técnicas e propor melhorias que possam contribuir para a qualidade desses produtos. Para a realização dos ensaios supracitado, este trabalho apoia-se na infraestrutura do Laboratório de Propriedades Mecânicas do IFF-Guarus em colaboração com o  grupo do Professor Carlos Maurício Fontes Vieira do Laboratório de Materiais Avançados da UENF e a cerâmica Sardinha localizada na baixada Campista.  "
https://suap.iff.edu.br/sisep/projeto/1196/,Padrões de sono em população exposta a resíduos industriais em condomínio habitacional de Volta Redonda - RJ,Pesquisa,14/03/2022,31/12/2022,SAÚDE COLETIVA (CIÊNCIAS DA SAÚDE),Meio Ambiente,"As sociedades modernas vivem um processo acelerado de degradação ambiental, trazendo consequências significativas para a população no que se refere ao adoecimento populacional. Os efeitos dessa degradação e os impactos que ocorrem na vida do planeta estão entre os grandes desafios enfrentados pela humanidade. No município de Volta Redonda, o Condomínio Volta Grande IV foi construído em terreno doado ao Sindicato dos Metalúrgicos em 1998 pela CSN. Entretanto, até 1999, a CSN depositou resíduos industriais em duas células localizadas no interior da empresa responsável pelo armazenamento e beneficiamento de escória de aciaria, situada em área adjacente ao terreno onde foi erguido o conjunto habitacional. Até o momento foram realizadas algumas inspeções, que detectaram contaminação ambiental. Sabe-se que  metais presentes no meio ambiente também podem afetar negativamente a qualidade do sono. O estudo do sono tem despertado interesse desde a antiguidade. Dessa forma, o objetivo deste estudo é  avaliar os padrões de sono em população exposta a resíduos industriais em condomínio habitacional de Volta Redonda, RJ."
https://suap.iff.edu.br/sisep/projeto/1139/,Nível de Conhecimento e Atitudes Demonstradas Por Portadores de Diabetes Tipo II: Estudo do Perfil dos Idosos Atendidos no IFF Campus Campos Guarús,Pesquisa,14/03/2022,31/12/2022,ENFERMAGEM (CIÊNCIAS DA SAÚDE),Saúde,"O aumento da expectativa de vida do brasileiro é uma conquista que traz consigo alguns desafios, tais como elevação da incidência e da prevalência das doenças crônicas não transmissíveis, entre elas a diabetes mellitus (DM). Sendo assim, este projeto busca identificar o perfil dos idosos portadores de diabetes mellitus tipo II atendidos no IFF Campus Campos Guarús/RJ, segundo suas variáveis clínicas e sócio-demográficas e de acordo com o nível de conhecimento e atitudes apresentados pelos mesmos em relação à doença. Métodos: O projeto será desenvolvido nas dependências do instituto, tendo como público alvo todos os idosos com diagnóstico de diabetes mellitus cadastrados nos projetos Vitalidade e Sistematização da Assistência de Enfermagem em Gerontologia do IFF Campus Campos Guarús. Os dados serão coletados através da aplicação de questionários contendo variáveis sócio demográficas e clínicas, além das versões brasileiras do Diabetes Knowledge Questionnaire (DKN-A) e do Diabetes Attitude Questionnaire (ATT-19). Os dados serão digitados no Excel e posteriormente exportados para o Statistical Package for the Social Sciences (SPSS), onde serão realizadas as análises descritivas das variáveis. Todos os participantes que aceitarem participar da pesquisa deverão ler e assinar o Termo de Consentimento Livre e Esclarecido, conforme a Resolução 466/12 do Conselho Nacional de Saúde. O projeto será submetido ao comitê de ética e pesquisa. Espera-se que esse estudo contribua para o reconhecimento da importância da avaliação do indivíduo com diabetes mellitus no tocante a variáveis biológicas e psicossociais, que podem interferir no manejo da doença pelo indivíduo ou na capacidade da família de colaborar com o cuidado em diabetes."
https://suap.iff.edu.br/sisep/projeto/1289/,Otimização do Problema de Corte Unidimensional via Web,Pesquisa,14/03/2022,31/12/2022,ENGENHARIA DE PRODUÇÃO (ENGENHARIAS),Tecnologia e Produção,"O projeto tem como objeto de estudo um clássico dos Problemas de Corte e Empacotamento e de considerável relevância no âmbito da Pesquisa Operacional, conhecido como Problema de Corte Unidimensional (PCU) (GILMORE; GOMORY, 1961). O PCU possui grande aplicabilidade em diversos setores produtivos que consideram as ações de corte na transformação de materiais em produtos semiacabados ou finais, tais como: construção civil, metal mecânico, moveleiro, entre outros. Sendo o PCU relacionado à classe NPdifícil, isto impõe relativa dificuldade a utilização de métodos exatos para obter solução em instâncias de grande porte do problema. Neste caso, algoritmos heurísticos são utilizados com relativo sucesso e propõe-se implementar algoritmos fundamentados na metodologia Reactive Greedy Randomized Adaptive Search Procedure (GRASP Reativo), combinados com técnica Geração de Colunas, para tratar o PCU (SILVA; VELASCO, 2021). Considerando, também, que uma tendência na área de pesquisa em tecnologia atual é a disponibilização de códigos, instâncias e resultados, de forma a alavancar a replicabilidade da pesquisa, a utilização de algoritmos e resultados pela comunidade científica (BISONG, 2019). Dessa forma, entende-se que os algoritmos projetados e implementados devem estabelecer avanços para o estado da arte, mas também estejam disponíveis para serem replicados, testados e adaptados por outros pesquisadores e desenvolvedores, preferencialmente, de forma online e integrada. Posto isto, além dos testes computacionais em instâncias da literatura e instâncias práticas retiradas de fábricas e do setor da construção civil que são utilizados na avaliação de desempenho dos algoritmos, o projeto considera o escopo de viabilizar um ambiente computacional na internet, de fácil utilização e direcionado a setores produtivos que se defrontam com o PCU na organização planejamento operacional."
https://suap.iff.edu.br/sisep/projeto/1187/,AMBIENTE DE APOIO À EXPLORAÇÃO DE PATENTES,Pesquisa,14/03/2022,31/12/2022,CIÊNCIA DA COMPUTAÇÃO (CIÊNCIAS EXATAS E DA TERRA),Tecnologia e Produção,"Atualmente,  pode-se encontrar uma vasta quantidade de dados publicada na Web, entretanto, vários estudos apontam a falta de ferramentas que proporcionem um ambiente suficiente para tarefas de investigação e exploração de informações. Pode-se citar como exemplo o portal do Instituto Nacional de Propriedade Industrial e o Portal Brasileiro de Dados Abertos que, apesar de publicarem frequente informações sobre patentes, possuem sistemas de busca limitados. Desse modo, o presente projeto propõe a estruturação e a montagem de um  banco de informações de patentes, com acesso público e gratuito, e a adaptação de uma nova ferramenta de apoio à exploração de inovações em patentes. Como resultados dessa pesquisa, o presente projeto propõe a modelagem e implementação de um banco de informações de patentes, a adaptação da ferramenta Xplain e a publicação de um novo sistema de busca e exploração de patentes. A montagem do banco de patentes e a adaptação da ferramenta se dará de forma iterativa e incremental, com avaliações com usuários ao final de cada iteração.
Observação: este projeto requer noções básicas de programação e estrutura de dados.

 "
https://suap.iff.edu.br/sisep/projeto/1218/,AVALIAÇÃO DAS PROPRIEDADES FÍSICAS E MECÂNICAS DOS PRODUTOS DE CERÂMICA VERMELHA DE CAMPOS DOS GOYTACAZES,Pesquisa,14/03/2022,31/12/2022,ENGENHARIA DE MATERIAIS E METALÚRGICA (ENGENHARIAS),Tecnologia e Produção,"No geral, os materiais cerâmicos são divididos em avançados e tradicionais, sendo que dentro deste último tem-se as ""cerâmicas vermelhas"" cuja definição possui um significado amplo, compreendendo aqueles materiais empregados na construção civil (argila expandida, tijolos, blocos, elementos vazados, lajes, telhas e tubos cerâmicos) e alguns de uso doméstico e afins.  Esses produtos, por sua vez, são obtidos em empresas denominadas cerâmicas. A região de Campos dos Goytacazes/RJ é um dos principais polos de produção desses produtos no Brasil. O principal objetivo desse trabalho é avaliar as propriedades físicas e mecânicas dos produtos oriundos das empresas cerâmicas da região.  Para tal serão realizados ensaios de absorção de água, densidade aparente e tensão de ruptura à flexão. Com isso, pretende-se verificar se os produtos estão em conformidade com as normas técnicas e propor melhorias que possam contribuir para a qualidade desses produtos. Para a realização dos ensaios supracitado, este trabalho apoia-se na infraestrutura do Laboratório de Propriedades Mecânicas do IFF-Guarus em colaboração com o  grupo do Professor Carlos Maurício Fontes Vieira do Laboratório de Materiais Avançados da UENF e a cerâmica Sardinha localizada na baixada Campista.  "
https://suap.iff.edu.br/sisep/projeto/1077/,AVALIAÇÃO GERIÁTRICA MULTIDIMENSIONAL (AGA): UMA FERRAMENTA FUNDAMENTAL NA ATENÇÃO À SAÚDE DA PESSOA IDOSA,Pesquisa,14/03/2022,31/12/2022,ENFERMAGEM (CIÊNCIAS DA SAÚDE),Saúde,"Resumo
Introdução: O envelhecimento da sociedade é um fenômeno universal caracterizado pela ampliação da esperança média de vida e redução da taxa de fertilidade. Este processo é permanentemente associado a um aumento da incapacidade, amplificando os custos sociais e de saúde. A Avaliação Geriátrica Multidimensional (AGA) é um processo diagnóstico multidimensional e tem por objetivo determinar as deficiências, incapacidades apresentadas pelo idoso. Objetivo: Avaliar a capacidade funcional e a mobilidade de idosos atendidos no Projeto Vitalidade do Instituto Federal Fluminense e desenvolver um plano de cuidados para a saúde do idoso. Metodologia: trata-se de um estudo quantitativo e transversal, que será desenvolvido no período de março de 2022 a março de 2023 com população de 100 idosos cadastrados no Projeto Vitalidade. Serão incluídos idosos a partir de 60 anos, de ambos os sexos que apresentem risco ou com algum grau de fragilidade. As informações coletadas serão referentes às características sociodemográficas e em seguida, serão utilizados os instrumentos de triagem rápida, capazes de reconhecer o idoso em risco de declínio funcional através da ferramenta Índice de vulnerabilidade Clínico-Funcional (IVCF). Uma vez identificados os idosos de moderado e alto risco clínico-funcional serão utilizados instrumentos padronizados para avaliar os fatores que interferem na saúde do idoso, tais como: equilíbrio, mobilidade e risco a quedas (sinal de Romberg, Get up and go, timed get up and go), capacidade funcional (escala de Katz e índice de Barthel, escala de Lawton), Função cognitiva e condições emocionais (miniexame do estado mental)
Todos os instrumentos serão realizados por meio de agendamento e realizada no ambulatório do Instituto Federal Fluminense e as análises estatísticas consistirão na estatística descritiva, sendo apresentadas as frequências de respostas.
Após aprovação do Comitê de Ética em Pesquisa, os dados serão colhidos por dois bolsistas, devidamente treinados para aplicar os instrumentos de coleta. Os participantes serão convidados a participar da pesquisa e assinar o Termo de Consentimento Livre e Esclarecido (TCLE)."
https://suap.iff.edu.br/sisep/projeto/1006/,Laboratório de Enfermagem: Proposta de Modelo para a otimização da prática de Técnicas de Enfermagem pelos discentes.,Pesquisa,01/09/2021,31/08/2022,ENFERMAGEM (CIÊNCIAS DA SAÚDE),Saúde,"Este projeto tem como objetivo propiciar aos alunos um espaço de construção, desenvolvimento e consolidação de habilidades psicomotoras e práticas do conhecimento em enfermagem, através de visão crítica e construtiva, múltiplas vivências relacionadas à sua área de formação e do treinamento continuado das atividades do cuidado e técnicas em enfermagem. Trata-se de um projeto de pesquisa na modalidade ICJ/CNPq que se propõe a reorganizar e otimizar a utilização do Laboratório de Fundamentos de Enfermagem pelos alunos do Curso Técnico em Enfermagem do IFF Campos campus Guarus, possibilitando a sedimentação dos conteúdos teóricos e práticos do cuidado em enfermagem, contribuindo assim para a formação de Técnicos em Enfermagem éticos, mais humanizados e  bem preparados tecnicamente e seguros de suas ações, o que se refletirá na melhoria qualidade da assistência prestada a população."
https://suap.iff.edu.br/sisep/projeto/992/,Influência da sujidade na eficiência dos módulos fotovoltaicos,Pesquisa,01/09/2021,31/08/2022,ENGENHARIA ELÉTRICA (ENGENHARIAS),Tecnologia e Produção,"Com o crescimento da energia solar fotovoltaica (ESFV) e, em geral, a ideia equivocada que esses sistemas não necessitem de manutenção. Entretanto, a sujidade dos módulos fotovoltaicos (MFVs) por meio da poluição atmosférica impacta negativamente no desempenho dos sistemas fotovoltaicos. Desta forma, o objetivo do estudo é avaliar a relação existente entre a sujidade por meio da poluição atmosférica e o desempenho dos MFVs instalados no Instituto Federal Fluminense (IFF) campus Campos-Guarus localizado no município de Campos dos Goytacazes/ RJ. Para isso, a metodologia será dividida em três etapas distintas. Na primeira etapa será realizada pesquisa experimental com dois módulos fotovoltaicos idênticos e colocados sob as mesmas condições de operação, porém um módulo será limpo periodicamente e ou continuará “sujo”. Nessas condições, serão realizados testes elétricos nos MFVs a fim de verificar a taxa de sujidade. Além disso, A outra etapa do projeto buscará identificar e quantificar a composição do material depositado sobre os MFVs a ser determinada por espectroscopia de fluorescência de raios-X por dispersão de energia. Por fim,  o trabalho irá determinar a periodicidade de manutenção preventiva (limpeza) para o sistema de geração distribuída (GD) por ESFV do IFF campus Campos-Guarus. Assim, espera-se que a pesquisa  consiga obter a diferença percentual na potência elétrica dos MFVs com a sujidade, a taxa de sujidade para o futuro sistema de GD de 55,44kWp em instalação no Bloco G do campus Campos-Guarus e identificar o conjunto de elementos químicos e materiais particulados (MP) depositados sobre os MFVs."
https://suap.iff.edu.br/sisep/projeto/997/,Sistematização da Assistência de Enfermagem em Gerontologia: Proposta de Atenção à Saúde do Idoso no Instituto Federal Fluminense.,Pesquisa,01/09/2021,31/08/2022,"O crescimento da população idosa é um fenômeno mundial e no Brasil, vem ocorrendo de forma acelerada, produzindo transformações em todas as esferas da sociedade, o que tem conduzido instâncias governamentais a estimularem o desenvolvimento de pesquisas em diversas temáticas dentro do contexto do envelhecimento. O presente projeto tem como objetivo geral: Implantar um modelo organizado e sistematizado de assistência de enfermagem voltado ao atendimento dos idosos cadastrados no Programa Vitalidade do IFF Campus Campos Guarús. Métodos: O projeto deverá ser desenvolvido nas dependências do instituto, tendo como público alvo todos os idosos cadastrados no Projeto Vitalidade, aos quais será oferecido atendimento individual uma vez na semana, gerando o preenchimento de um instrumento específico denominado: Ficha de Saúde do Idoso. Dentre os resultados esperados, destacam-se ações de promoção a saúde individual e coletiva dos idosos, incentivo aos discentes bolsistas à produção científica e colaboração com a proposta de integração do IFF à sociedade, para que a instituição continue transformando positivamente o meio social onde está inserida.",,
https://suap.iff.edu.br/sisep/projeto/997/,Sistematização da Assistência de Enfermagem em Gerontologia: Proposta de Atenção à Saúde do Idoso no Instituto Federal Fluminense.,Pesquisa,01/09/2021,31/08/2022,"O crescimento da população idosa é um fenômeno mundial e no Brasil, vem ocorrendo de forma acelerada, produzindo transformações em todas as esferas da sociedade, o que tem conduzido instâncias governamentais a estimularem o desenvolvimento de pesquisas em diversas temáticas dentro do contexto do envelhecimento. O presente projeto tem como objetivo geral: Implantar um modelo organizado e sistematizado de assistência de enfermagem voltado ao atendimento dos idosos cadastrados no Programa Vitalidade do IFF Campus Campos Guarús. Métodos: O projeto deverá ser desenvolvido nas dependências do instituto, tendo como público alvo todos os idosos cadastrados no Projeto Vitalidade, aos quais será oferecido atendimento individual uma vez na semana, gerando o preenchimento de um instrumento específico denominado: Ficha de Saúde do Idoso. Dentre os resultados esperados, destacam-se ações de promoção a saúde individual e coletiva dos idosos, incentivo aos discentes bolsistas à produção científica e colaboração com a proposta de integração do IFF à sociedade, para que a instituição continue transformando positivamente o meio social onde está inserida.",,
https://suap.iff.edu.br/sisep/projeto/1006/,Laboratório de Enfermagem: Proposta de Modelo para a otimização da prática de Técnicas de Enfermagem pelos discentes.,Pesquisa,01/09/2021,31/08/2022,ENFERMAGEM (CIÊNCIAS DA SAÚDE),Saúde,"Este projeto tem como objetivo propiciar aos alunos um espaço de construção, desenvolvimento e consolidação de habilidades psicomotoras e práticas do conhecimento em enfermagem, através de visão crítica e construtiva, múltiplas vivências relacionadas à sua área de formação e do treinamento continuado das atividades do cuidado e técnicas em enfermagem. Trata-se de um projeto de pesquisa na modalidade ICJ/CNPq que se propõe a reorganizar e otimizar a utilização do Laboratório de Fundamentos de Enfermagem pelos alunos do Curso Técnico em Enfermagem do IFF Campos campus Guarus, possibilitando a sedimentação dos conteúdos teóricos e práticos do cuidado em enfermagem, contribuindo assim para a formação de Técnicos em Enfermagem éticos, mais humanizados e  bem preparados tecnicamente e seguros de suas ações, o que se refletirá na melhoria qualidade da assistência prestada a população."
https://suap.iff.edu.br/sisep/projeto/992/,Influência da sujidade na eficiência dos módulos fotovoltaicos,Pesquisa,01/09/2021,31/08/2022,ENGENHARIA ELÉTRICA (ENGENHARIAS),Tecnologia e Produção,"Com o crescimento da energia solar fotovoltaica (ESFV) e, em geral, a ideia equivocada que esses sistemas não necessitem de manutenção. Entretanto, a sujidade dos módulos fotovoltaicos (MFVs) por meio da poluição atmosférica impacta negativamente no desempenho dos sistemas fotovoltaicos. Desta forma, o objetivo do estudo é avaliar a relação existente entre a sujidade por meio da poluição atmosférica e o desempenho dos MFVs instalados no Instituto Federal Fluminense (IFF) campus Campos-Guarus localizado no município de Campos dos Goytacazes/ RJ. Para isso, a metodologia será dividida em três etapas distintas. Na primeira etapa será realizada pesquisa experimental com dois módulos fotovoltaicos idênticos e colocados sob as mesmas condições de operação, porém um módulo será limpo periodicamente e ou continuará “sujo”. Nessas condições, serão realizados testes elétricos nos MFVs a fim de verificar a taxa de sujidade. Além disso, A outra etapa do projeto buscará identificar e quantificar a composição do material depositado sobre os MFVs a ser determinada por espectroscopia de fluorescência de raios-X por dispersão de energia. Por fim,  o trabalho irá determinar a periodicidade de manutenção preventiva (limpeza) para o sistema de geração distribuída (GD) por ESFV do IFF campus Campos-Guarus. Assim, espera-se que a pesquisa  consiga obter a diferença percentual na potência elétrica dos MFVs com a sujidade, a taxa de sujidade para o futuro sistema de GD de 55,44kWp em instalação no Bloco G do campus Campos-Guarus e identificar o conjunto de elementos químicos e materiais particulados (MP) depositados sobre os MFVs."
